Title,URL,Category 1,Category 2
"La Miglior TV da 32 Pollici Full HD – Recensioni, Classifica 2022",https://latop10.it/migliori-tv-da-32-pollici-full-hd/,Elettronica,TV
"La Migliore TV da 40 Pollici 4K – Recensioni, Classifica 2022",https://latop10.it/migliori-tv-da-40-pollici-4k/,Elettronica,TV
"La Migliore TV LED da 43 Pollici (anche Smart, 4K) – Classifica 2022",https://latop10.it/migliori-tv-led-da-43-pollici/,Elettronica,TV
"Il Miglior Televisore da 20 Pollici – Recensioni, Classifica 2022",https://latop10.it/migliori-televisori-da-20-pollici/,Elettronica,TV
Il Miglior Televisore Samsung da 32 Pollici – Classifica 2022,https://latop10.it/migliori-televisori-samsung-da-32-pollici/,Elettronica,TV
"La Miglior TV 4K Sony – Recensioni, Opinioni 2021",https://latop10.it/migliori-tv-4k-sony/,Elettronica,TV
"La Miglior TV OLED 4K – Recensioni, Classifica 2022",https://latop10.it/la-miglior-tv-oled-4k-recensioni-classifica-2020/,Elettronica,TV
"La Miglior Smart TV Samsung (anche 4K) – Recensioni, Opinioni 2021",https://latop10.it/migliori-smart-tv-samsung/,Elettronica,TV
"La Miglior Smart TV 3D – Recensioni, Classifica 2022",https://latop10.it/migliori-smart-tv-3d/,Elettronica,TV
"La Miglior TV LED Samsung (anche 4K) – Recensioni, Opinioni 2021",https://latop10.it/migliori-tv-led-samsung/,Elettronica,TV
"La Migliore Videocamera 4K – Guida all’Acquisto, Classifica 2022",https://latop10.it/migliori-videocamere-4k/,Elettronica,Videocamera
La Migliore Videocamera Full HD (anche Economiche) del 2022,https://latop10.it/migliori-videocamere-full-hd/,Elettronica,Videocamera
La Migliore Action Cam (anche Economica) – Recensioni 2022,https://latop10.it/migliori-action-cam/,Elettronica,Videocamera
La Miglior Videocamera Digitale – Classifica 2022,https://latop10.it/migliori-videocamere-digitali/,Elettronica,Videocamera
La Migliore Videocamera (anche 4K e Professionale) del 2022,https://latop10.it/migliori-videocamere/,Elettronica,Videocamera
La Migliore Action Cam 4K (Ultra HD) – Classifica 2022,https://latop10.it/migliori-action-cam-4k/,Elettronica,Videocamera
"Apeman A80 – Recensione, Opinioni, Prezzi del 2022",https://latop10.it/apeman-a80-recensione/,Elettronica,Videocamera
La Miglior Videocamera Sportiva (anche Economiche) – Classifica 2022,https://latop10.it/migliori-videocamere-sportive/,Elettronica,Videocamera
La Miglior Action Cam Subacquea – Classifica 2022,https://latop10.it/migliori-action-cam-subacquee/,Elettronica,Videocamera
"La Migliore Videocamera Canon – Recensioni, Opinioni 2021",https://latop10.it/migliori-videocamere-canon/,Elettronica,Videocamera
La Miglior Videocamera per Droni (Telecamera) – Classifica 2022,https://latop10.it/migliori-videocamere-per-droni/,Elettronica,Videocamera
"La Miglior Videocamera Sony – Recensioni, Opinioni 2021",https://latop10.it/migliori-videocamere-sony/,Elettronica,Videocamera
"La Migliore Videocamera JVC – Opinioni, Recensioni 2022",https://latop10.it/migliori-videocamere-jvc/,Elettronica,Videocamera
