Title,URL,Category 1,Category 2
Il Miglior Amplificatore Integrato Hi-Fi – Classifica 2022,https://latop10.it/migliori-amplificatori-integrati-hifi/,Elettronica,Amplificatore
"Il Miglior Sintoamplificatore – Guida all’Acquisto, Classifica 2022",https://latop10.it/migliori-sintoamplificatori/,Elettronica,Amplificatore
Il Miglior Amplificatore Valvolare – Classifica 2022,https://latop10.it/migliori-amplificatori-valvolari/,Elettronica,Amplificatore
Il Miglior Sintoamplificatore 5.1 – Classifica 2022,https://latop10.it/migliori-sintoamplificatori-5-1/,Elettronica,Amplificatore
"Il Miglior Amplificatore Yamaha – Recensioni, Classifica 2022",https://latop10.it/migliori-amplificatori-yamaha/,Elettronica,Amplificatore
"Il Miglior Sintoamplificatore Yamaha – Recensioni, Opinioni 2021",https://latop10.it/migliori-sintoamplificatori-yamaha/,Elettronica,Amplificatore
"Il Miglior Amplificatore per Subwoofer – Recensioni, Classifica 2022",https://latop10.it/migliori-amplificatori-per-subwoofer/,Elettronica,Amplificatore
"Il Miglior Amplificatore Stereo – Recensioni, Classifica 2022",https://latop10.it/migliori-amplificatori-stereo/,Elettronica,Amplificatore
"Il Miglior Sintoamplificatore Onkyo – Recensioni, Opinioni 2021",https://latop10.it/migliori-sintoamplificatori-onkyo/,Elettronica,Amplificatore
"Il Miglior Amplificatore per Chitarra – Recensioni, Classifica 2022",https://latop10.it/migliori-amplificatori-per-chitarra/,Elettronica,Amplificatore
Il Miglior Decoder Tivusat Economico del 2022,https://latop10.it/decoder-tivusat-economico/,Elettronica,Antenna & Ricevitore TV
La Miglior Antenna TV Esterna per Digitale Terrestre del 2022,https://latop10.it/miglior-antenna-tv-esterna-per-digitale-terrestre/,Elettronica,Antenna & Ricevitore TV
La Migliore Antenna Interna TV per Digitale Terrestre del 2022,https://latop10.it/migliori-antenne-interne-tv/,Elettronica,Antenna & Ricevitore TV
Il Miglior Decoder per Digitale Terrestre – Classifica 2022,https://latop10.it/migliori-decoder-digitale/,Elettronica,Antenna & Ricevitore TV
La Migliore Parabola Satellitare – Classifica 2022,https://latop10.it/migliori-parabole-satellitari/,Elettronica,Antenna & Ricevitore TV
"La Miglior Parabola Sky – Opinioni, Recensioni 2022",https://latop10.it/migliori-parabole-sky/,Elettronica,Antenna & Ricevitore TV
"La Miglior Parabola Satellitare (Piatte, anche per Camper) del 2022",https://latop10.it/migliori-parabole/,Elettronica,Antenna & Ricevitore TV
"Il Miglior Decoder Satellitare (Ricevitore, TV SAT, anche HD) del 2022",https://latop10.it/migliori-decoder-satellitari/,Elettronica,Antenna & Ricevitore TV
Il Miglior Decoder Satellitare HD (TV SAT) – Classifica 2022,https://latop10.it/migliori-decoder-satellitari-hd/,Elettronica,Antenna & Ricevitore TV
Il Miglior Ricevitore Satellitare Humax – Classifica 2022,https://latop10.it/migliori-ricevitori-satellitari-humax/,Elettronica,Antenna & Ricevitore TV
Il Miglior Decoder Satellitare TV Sat – Classifica 2022,https://latop10.it/migliori-decoder-satellitari-tv-sat/,Elettronica,Antenna & Ricevitore TV
Il Miglior Amplificatore di Segnale TV (Antenna) – Classifica 2022,https://latop10.it/migliori-amplificatori-di-segnale-tv/,Elettronica,Antenna & Ricevitore TV
La Migliore Parabola Satellitare da 80 cm – Classifica 2022,https://latop10.it/migliori-parabole-satellitari-da-80-cm/,Elettronica,Antenna & Ricevitore TV
"La Migliore Antenna FM da Interno – Recensioni, Classifica 2022",https://latop10.it/migliori-antenne-fm-da-interno/,Elettronica,Antenna & Ricevitore TV
Il Miglior Decoder Digitale Terrestre HD – Classifica 2022,https://latop10.it/migliori-decoder-digitali-terrestri-hd/,Elettronica,Antenna & Ricevitore TV
"La Migliore Parabola Portatile – Recensioni, Classifica 2022",https://latop10.it/migliori-parabole-portatili/,Elettronica,Antenna & Ricevitore TV
"La Migliore Antenna da Interno 1byone – Opinioni, Recensioni 2022",https://latop10.it/migliori-antenne-da-interno-1byone/,Elettronica,Antenna & Ricevitore TV
"Gli 8 Migliori Hard Disk Esterni (Affidabili, per PC or Mac) del 2022",https://latop10.it/migliori-hard-disk-esterni/,Elettronica,Archivio dati
La Migliore Chiavetta USB (anche Veloce) – Classifica 2022,https://latop10.it/migliori-chiavette-usb/,Elettronica,Archivio dati
La Migliore Micro SD (Schede SD) – Classificazione 2020,https://latop10.it/migliori-micro-sd/,Elettronica,Archivio dati
"Il Miglior Hard Disk Esterno Maxtor – Opinioni, Recensioni 2022",https://latop10.it/migliori-hard-disk-esterni-maxtor/,Elettronica,Archivio dati
"Il Miglior Hard Disk Esterno da 1 TB – Recensioni, Classifica 2022",https://latop10.it/migliori-hard-disk-esterni-da-1-tb/,Elettronica,Archivio dati
"La Miglior Pen Drive (Chiavetta USB) – Recensioni, Classifica 2022",https://latop10.it/migliori-pen-drive/,Elettronica,Archivio dati
"La Migliore Scheda di Memoria SD – Recensioni, Classifica 2022",https://latop10.it/migliori-schede-di-memoria-sd/,Elettronica,Archivio dati
"Il Miglior CD Vergine – Recensioni, Classifica 2022",https://latop10.it/migliori-cd-vergini/,Elettronica,Archivio dati
"JBL Charge 3 – Recensione, Opinioni, Prezzi del 2022",https://latop10.it/jbl-charge-3-recensione/,Elettronica,Audio portatile
"La Migliore Cassa Bluetooth – Guida all’Acquisto, Classifica 2022",https://latop10.it/migliori-casse-bluetooth/,Elettronica,Audio portatile
"Il Miglior Ricevitore / Trasmettitore Audio Bluetooth (Per TV, Casse o Auto)",https://latop10.it/migliori-ricevitori-audio-bluetooth/,Elettronica,Audio portatile
"La Migliore Radio Digitale (anche Portatili, Dab) – Classifica 2022",https://latop10.it/migliori-radio-digitali/,Elettronica,Audio portatile
"Bose Soundlink Mini 2 – Recensione, Opinioni, Prezzi del 2022",https://latop10.it/bose-soundlink-mini-2-recensione/,Elettronica,Audio portatile
Il Miglior Ricevitore Bluetooth Audio per HiFi – Classifica 2022,https://latop10.it/migliori-ricevitori-bluetooth-audio-per-hi-fi/,Elettronica,Audio portatile
La Miglior Radio Portatile (anche Digitale) – Classifica 2022,https://latop10.it/migliori-radio-portatili/,Elettronica,Audio portatile
"Il Miglior Stereo Portatile – Recensioni, Classifica 2022",https://latop10.it/migliori-stereo-portatili/,Elettronica,Audio portatile
Il Miglior Altoparlante Wireless (Casse Bluetooth) – Classifica 2022,https://latop10.it/migliori-altoparlanti-wireless/,Elettronica,Audio portatile
"La Miglior Radio CD Portatile – Recensioni, Classifica 2022",https://latop10.it/migliori-radio-cd-portatili/,Elettronica,Audio portatile
"La Miglior Radio CD – Recensioni, Classifica 2022",https://latop10.it/migliori-radio-cd/,Elettronica,Audio portatile
"Il Miglior Smart Speaker – Recensioni, Classifica 2022",https://latop10.it/migliori-smart-speaker/,Elettronica,Audio portatile
"La Migliore Radio Vhf Portatile – Recensioni, Classifica 2022",https://latop10.it/migliori-radio-vhf-portatili/,Elettronica,Audio portatile
"La Migliore Radio Bluetooth – Recensioni, Classifica 2022",https://latop10.it/migliori-radio-bluetooth/,Elettronica,Audio portatile
Le Migliori Cuffie Gaming (anche Economiche) – Classifica 2022,https://latop10.it/migliori-cuffie-da-gaming/,Elettronica,Auricolari & Cuffie
I Migliori Auricolari (anche Economici) – Classifica 2022,https://latop10.it/migliori-auricolari/,Elettronica,Auricolari & Cuffie
Le Migliori Cuffie Noise Cancelling – Classifica del 2022,https://latop10.it/migliori-cuffie-noise-cancelling/,Elettronica,Auricolari & Cuffie
"I Migliori Auricolari Bluetooth (Wireless, anche per Sport) del 2022",https://latop10.it/migliori-auricolari-bluetooth/,Elettronica,Auricolari & Cuffie
"Le Migliori Cuffie Wireless da Running (Auricolari Sport, per Correre)",https://latop10.it/migliori-cuffie-wireless-da-running/,Elettronica,Auricolari & Cuffie
I Migliori Auricolari non in Ear – Classifica 2022,https://latop10.it/migliori-auricolari-non-in-ear/,Elettronica,Auricolari & Cuffie
"Le Migliori Cuffie Antirumore (Insonorizzate, per Studiare) del 2022",https://latop10.it/migliori-cuffie-antirumore/,Elettronica,Auricolari & Cuffie
Il Miglior Auricolare Bluetooth Cellular Line – Classifica 2022,https://latop10.it/migliori-auricolari-bluetooth-cellular-line/,Elettronica,Auricolari & Cuffie
La Miglior Cuffia Antirumore da Lavoro – Classifica 2022,https://latop10.it/migliori-cuffie-antirumore-da-lavoro/,Elettronica,Auricolari & Cuffie
"Le Migliori Cuffie Over Ear (Bluetooth) – Recensioni, Classifica 2022",https://latop10.it/migliori-cuffie-over-ear/,Elettronica,Auricolari & Cuffie
"Le Migliori Cuffie Beats by Dr. Dre – Recensioni, Opinioni 2021",https://latop10.it/migliori-cuffie-beats-by-dr-dre/,Elettronica,Auricolari & Cuffie
"I Migliori Auricolari Bluetooth per Samsung – Recensioni, Opinioni 2021",https://latop10.it/migliori-auricolari-bluetooth-per-samsung/,Elettronica,Auricolari & Cuffie
"La Miglior Scheda Madre da Gaming – Recensioni, Classifica 2022",https://latop10.it/migliori-schede-madri-da-gaming/,Elettronica,Auricolari & Cuffie
"Le Migliori Cuffie Bluetooth – Recensioni, Classifica 2022",https://latop10.it/migliori-cuffie-bluetooth/,Elettronica,Auricolari & Cuffie
Le Migliori Cuffie Wireless per TV (senza Fili) – Classifica 2022,https://latop10.it/migliori-cuffie-wireless-per-tv/,Elettronica,Auricolari & Cuffie
Il Miglior Ricevitore Bluetooth per Cuffie – Classifica 2022,https://latop10.it/migliori-ricevitori-bluetooth-per-cuffie/,Elettronica,Auricolari & Cuffie
"Le Migliori Cuffie del 2022 (anche Bluetooth, Economiche, per Musica)",https://latop10.it/migliori-cuffie/,Elettronica,Auricolari & Cuffie
"Le Migliori Cuffie con Microfono – Recensioni, Classifica 2022",https://latop10.it/migliori-cuffie-con-microfono/,Elettronica,Auricolari & Cuffie
Il Miglior Caricabatterie Portatile – Classifica 2022,https://latop10.it/migliori-caricabatterie-portatili/,Elettronica,Caricatore
"Il Miglior Power Bank Solare – Guida all’Acquisto, Classifica 2022",https://latop10.it/migliori-power-bank-solari/,Elettronica,Caricatore
Il Miglior Caricabatteria per Pile Ricaricabili – Classifica 2022,https://latop10.it/migliori-caricabatterie-per-pile-ricaricabili/,Elettronica,Caricatore
"La Migliore Powerbank AUKEY – Recensioni, Opinioni 2021",https://latop10.it/migliori-powerbank-aukey/,Elettronica,Caricatore
"Il Miglior Powerbank da 20 000 mAh – Recensioni, Classifica 2022",https://latop10.it/migliori-powerbank-20-000-mah/,Elettronica,Caricatore
Il Miglior Caricabatterie Portatile per iPhone – Classifica 2022,https://latop10.it/migliori-caricabatterie-portatili-per-iphone/,Elettronica,Caricatore
"Il Miglior Caricabatterie a Induzione – Recensioni, Classifica 2022",https://latop10.it/migliori-caricabatterie-a-induzione/,Elettronica,Caricatore
"Il Miglior Caricatore per Cellulare – Recensioni, Classifica 2022",https://latop10.it/migliori-caricatori-per-cellulare/,Elettronica,Caricatore
"La Migliore Stazione di Ricarica – Recensioni, Classifica 2022",https://latop10.it/migliori-stazioni-di-ricarica/,Elettronica,Caricatore
"La Migliore Batteria Esterna Portatile – Recensioni, Classifica 2022",https://latop10.it/migliori-batterie-esterne-portatili/,Elettronica,Caricatore
"Bose Solo 5 TV – Recensioni, Opinioni, Prezzi del 2022",https://latop10.it/bose-solo-5-tv-recensione/,Elettronica,Casse & Soundbar
"Il Miglior Home Theatre – Guida all’Acquisto, Classifica 2022",https://latop10.it/migliori-home-theatre/,Elettronica,Casse & Soundbar
"Le Migliori Casse per PC – Guida all’Acquisto, Classifica 2022",https://latop10.it/migliori-casse-per-pc/,Elettronica,Casse & Soundbar
La Migliore Soundbar – Quale Scegliere? Classifica 2022,https://latop10.it/migliori-soundbar/,Elettronica,Casse & Soundbar
Il Miglior Stereo Hi-fi Compatto e Mini – Classifica 2022,https://latop10.it/migliori-stereo-hi-fi-compatti/,Elettronica,Casse & Soundbar
"Il Miglior Subwoofer (Attivo, anche per Auto e Casa) del 2022",https://latop10.it/migliori-subwoofer/,Elettronica,Casse & Soundbar
"La Miglior LG Soundbar – Opinioni, Recensioni 2022",https://latop10.it/migliori-lg-soundbar/,Elettronica,Casse & Soundbar
"Le Migliori Casse Acustiche (Diffusori HiFi, Professionali e per Casa)",https://latop10.it/migliori-casse-acustiche/,Elettronica,Casse & Soundbar
Il Miglior Home Theatre Wireless (senza Fili) – Classifica 2022,https://latop10.it/migliori-home-theatre-wireless/,Elettronica,Casse & Soundbar
"La Migliore Soundbar Yamaha – Opinioni, Recensioni 2022",https://latop10.it/migliori-soundbar-yamaha/,Elettronica,Casse & Soundbar
Le Migliori Casse Amplificate (anche Economiche) – Classifica 2022,https://latop10.it/migliori-casse-amplificate/,Elettronica,Casse & Soundbar
"La Miglior Soundbar Samsung – Opinioni, Recensioni 2022",https://latop10.it/migliori-soundbar-samsung/,Elettronica,Casse & Soundbar
La Miglior Cassa Acustica da Esterno – Classifica 2022,https://latop10.it/migliori-casse-acustiche-da-esterno/,Elettronica,Casse & Soundbar
Le Migliori Casse Acustiche da Pavimento – Classifica 2022,https://latop10.it/migliori-casse-acustiche-da-pavimento/,Elettronica,Casse & Soundbar
"La Miglior Soundbar 2.1 – Guida all’Acquisto, Classifica 2022",https://latop10.it/migliori-soundbar-2-1/,Elettronica,Casse & Soundbar
Il Migliore Cassa Amplificata per Karaoke – Classifica 2022,https://latop10.it/migliori-casse-amplificate-per-karaoke/,Elettronica,Casse & Soundbar
"Il Migliore Home Theatre Yamaha – Opinioni, Recensioni 2022",https://latop10.it/migliori-home-theatre-yamaha/,Elettronica,Casse & Soundbar
"Le Migliori Casse Acustiche Passive – Recensioni, Classifica 2022",https://latop10.it/migliori-casse-acustiche-passive/,Elettronica,Casse & Soundbar
Le Migliori Casse Amplificate Attive (Acustiche) – Classifica 2022,https://latop10.it/migliori-casse-amplificate-attive/,Elettronica,Casse & Soundbar
"Il Miglior Home Theatre Bose – Recensioni, Opinioni 2021",https://latop10.it/migliori-home-theatre-bose/,Elettronica,Casse & Soundbar
"Il Miglior Home Theatre Samsung – Recensioni, Opinioni 2021",https://latop10.it/migliori-home-theatre-samsung/,Elettronica,Casse & Soundbar
"Il Migliore Home Theatre 5.1 – Recensioni, Classifica 2022",https://latop10.it/migliori-home-theatre-5-1/,Elettronica,Casse & Soundbar
"Il Miglior Sistema Audio – Recensioni, Classifica 2022",https://latop10.it/migliori-sistemi-audio/,Elettronica,Casse & Soundbar
"La Miglior Soundbar per PC – Recensioni, Classifica 2022",https://latop10.it/migliori-soundbar-per-pc/,Elettronica,Casse & Soundbar
"Il Miglior Sistema Micro HiFi di Sony – Recensioni, Classifica 2022",https://latop10.it/migliori-sistemi-micro-hifi-di-sony/,Elettronica,Casse & Soundbar
"La Miglior Cassa 5.1 – Recensioni, Classifica 2022",https://latop10.it/migliori-casse-5-1/,Elettronica,Casse & Soundbar
"Il Miglior Subwoofer Amplificato – Recensioni, Classifica 2022",https://latop10.it/migliori-subwoofer-amplificati/,Elettronica,Casse & Soundbar
"La Migliore Soundbar LG – Recensioni, Opinioni 2021",https://latop10.it/migliori-soundbar-lg/,Elettronica,Casse & Soundbar
"Il Miglior Cavo HDMI 4K (per TV, PS4, …) del 2022",https://latop10.it/migliori-cavi-hdmi/,Elettronica,Cavo
Il Miglior Cavo VGA HDMI (Convertitore) – Classifica 2022,https://latop10.it/migliori-cavi-vga-hdmi/,Elettronica,Cavo
"Il Miglior Cavo HDMI Micro USB – Guida all’Acquisto, Classifica 2022",https://latop10.it/migliori-cavi-hdmi-micro-usb/,Elettronica,Cavo
Il Miglior Adattatore USB a HDMI – Classifica 2022,https://latop10.it/migliori-adattatori-usb-a-hdmi/,Elettronica,Cavo
"Il Miglior Cavo USB Type C – Guida all’Acquisto, Classifica 2022",https://latop10.it/migliori-cavi-usb-type-c/,Elettronica,Cavo
"Il Miglior Splitter HDMI – Guida all’Acquisto, Classifica 2022",https://latop10.it/migliori-splitter-hdmi/,Elettronica,Cavo
"Il Miglior Cavo USB (anche di Tipo C) – Recensioni, Classifica 2022",https://latop10.it/migliori-cavi-usb/,Elettronica,Cavo
"Il Miglior Cavo da Wii a HDMI – Recensioni, Classifica 2022",https://latop10.it/migliori-cavi-da-wii-a-hdmi/,Elettronica,Cavo
"Il Miglior Cavo HDMI 4K – Recensioni, Classifica 2022",https://latop10.it/migliori-cavi-hdmi-4k/,Elettronica,Cavo
"Il Miglior Cavo USB SATA – Recensioni, Classifica 2022",https://latop10.it/migliori-cavi-usb-sata/,Elettronica,Cavo
La Migliore Scheda Video (per Gaming e Editing 4k) – Classifica 2022,https://latop10.it/migliori-schede-video/,Elettronica,Componenti PC
"La Migliore Scheda Madre – Guida all’Acquisto, Classifica 2022",https://latop10.it/migliori-schede-madri/,Elettronica,Componenti PC
"Il Miglior Processore per PC (anche Potenti, Intel e AMD) del 2022",https://latop10.it/migliori-processori-pc/,Elettronica,Componenti PC
La Migliore Scheda Audio (Esterne o Interne) del 2022,https://latop10.it/migliori-schede-audio/,Elettronica,Componenti PC
"La Miglior Scheda di Rete (WiFi, Wireless, Ethernet, per Fibra)",https://latop10.it/migliori-schede-di-rete/,Elettronica,Componenti PC
Il Miglior Masterizzatore Esterno per PC – Classifica 2022,https://latop10.it/migliori-masterizzatori-esterni/,Elettronica,Componenti PC
Il Miglior Dissipatore CPU (a liquido e ad Aria) del 2022,https://latop10.it/migliori-dissipatori-cpu/,Elettronica,Componenti PC
Il Miglior Hub USB (anche Alimentato) – Classifica 2022,https://latop10.it/migliori-hub-usb/,Elettronica,Componenti PC
La Miglior Ventola CPU Silenziosa – Classifica 2022,https://latop10.it/migliori-ventole-cpu-silenziose/,Elettronica,Componenti PC
Il Miglior Masterizzatore Esterno Blu-ray – Classifica 2022,https://latop10.it/migliori-masterizzatori-esterni-blu-ray/,Elettronica,Componenti PC
La Miglior Batteria per Computer Portatile – Classifica 2022,https://latop10.it/migliori-batterie-per-computer-portatili/,Elettronica,Componenti PC
"La Miglior Webcam (per PC) – Recensioni, Classifica 2022",https://latop10.it/migliori-webcam/,Elettronica,Componenti PC
"Il Miglior Alimentatore per PC – Recensioni, Classifica 2022",https://latop10.it/migliori-alimentatori-per-pc/,Elettronica,Componenti PC
"Il Miglior Modulo RAM da 8 GB – Recensioni, Classifica 2022",https://latop10.it/migliori-moduli-ram-da-8-gb/,Elettronica,Componenti PC
"Il Miglior Case Esterno per Hard Disk (Box) – Recensioni, Classifica 2022",https://latop10.it/migliori-case-esterni-per-hard-disk/,Elettronica,Componenti PC
"Il Miglior Case per PC (anche per Gaming, Economico) – Classifica 2022",https://latop10.it/migliori-case-per-pc/,Elettronica,Componenti PC
"Il Miglior Generatore di Corrente (Gruppi Elettrogeni, anche Silenziati) del 2022",https://latop10.it/migliori-generatori-di-corrente/,Elettronica,Elettricità
Il Miglior Gruppo di Continuità UPS – Classifica 2022,https://latop10.it/migliori-gruppi-di-continuita-ups-2/,Elettronica,Elettricità
"Il Miglior Inverter 12V 220V (per Camper, Auto) – Classifica 2022",https://latop10.it/migliori-inverter-12v-220v/,Elettronica,Elettricità
"Il Miglior Generatore Eolico (anche Portatile, Domestico) del 2022",https://latop10.it/migliori-generatori-eoliche/,Elettronica,Elettricità
Il Miglior Inverter a Onda Pura (Sinusoidale) del 2022,https://latop10.it/migliori-inverter-a-onda-pura/,Elettronica,Elettricità
Il Miglior Trasformatore da 220v a 12v – Classifica 2022,https://latop10.it/migliori-trasformatori-da-220v-a-12v/,Elettronica,Elettricità
Il Miglior Trasformatore da 220v a 110v – Classifica 2022,https://latop10.it/migliori-trasformatori-da-220v-a-110v/,Elettronica,Elettricità
Il Miglior Gruppo di Continuità UPS – Classifica 2022,https://latop10.it/migliori-gruppi-di-continuita-ups/,Elettronica,Elettricità
Il Miglior Gruppo di Continuità per Modem (Router) – Classifica 2022,https://latop10.it/migliori-gruppi-di-continuita-per-modem/,Elettronica,Elettricità
Il Miglior Inverter 12v 220v a Onda Sinusoidale Pura del 2022,https://latop10.it/migliori-inverter-12v-220v-a-onda-sinusoidale-pura/,Elettronica,Elettricità
"Il Miglior Inverter 12V 220V 3000W – Recensioni, Classifica 2022",https://latop10.it/migliori-inverter-12v-220v-3000w/,Elettronica,Elettricità
"Il Miglior Pannello Solare – Recensioni, Classifica 2022",https://latop10.it/migliori-pannelli-solari/,Elettronica,Elettricità
"Il Miglior Stabilizzatore di Tensione – Recensioni, Classifica 2022",https://latop10.it/migliori-stabilizzatore-di-tensione/,Elettronica,Elettricità
"Il Miglior Inverter Fotovoltaico – Recensioni, Classifica 2022",https://latop10.it/migliori-inverter-fotovoltaici/,Elettronica,Elettricità
La Migliore Fotocamera Compatta – Classifica 2022,https://latop10.it/migliori-fotocamere-compatte/,Elettronica,Fotocamera
"La Migliore Fotocamera Reflex – Guida all’Acquisto, Classifica 2022",https://latop10.it/migliori-fotocamere-reflex/,Elettronica,Fotocamera
La Migliore Fotocamera Subacquea del 2022,https://latop10.it/migliori-fotocamere-subacquee/,Elettronica,Fotocamera
La Migliore Macchina Fotografica Istantanea (Polaroid) del 2022,https://latop10.it/migliori-macchine-fotografiche-istantanee/,Elettronica,Fotocamera
La Migliore Macchina Fotografica per Bambini – Classifica 2022,https://latop10.it/migliori-macchine-fotografiche-per-bambini/,Elettronica,Fotocamera
"Polaroid Snap Touch – Recensione, Opinioni, Prezzi del 2022",https://latop10.it/polaroid-snap-touch-recensione/,Elettronica,Fotocamera
La Migliore Macchina Fotografica Digitale – Classifica 2022,https://latop10.it/migliori-macchine-fotografiche-digitali/,Elettronica,Fotocamera
"La Miglior Fotocamera Mirrorless Canon – Recensioni, Classifica 2022",https://latop10.it/migliori-fotocamere-mirrorless-canon/,Elettronica,Fotocamera
"La Miglior Fotocamera Compatta Canon – Recensioni, Classifica 2022",https://latop10.it/migliori-fotocamere-compatte-canon/,Elettronica,Fotocamera
La Miglior Fotocamera Mirrorless Olympus – Recensioni 2022,https://latop10.it/migliori-fotocamere-mirrorless-olympus/,Elettronica,Fotocamera
"La Miglior Fotocamera Subacquea Nikon – Recensioni, Opinioni 2020",https://latop10.it/migliori-fotocamere-subacquee-nikon/,Elettronica,Fotocamera
"La Migliore Fotocamera Compatta Sony – Recensioni, Opinioni 2020",https://latop10.it/migliori-fotocamere-compatte-sony/,Elettronica,Fotocamera
"La Migliore Pellicola Istantanea – Recensioni, Classifica 2022",https://latop10.it/migliori-pellicole-istantanee/,Elettronica,Fotocamera
"La Migliore Carta Fotografica – Recensioni, Classifica 2022",https://latop10.it/migliori-carte-fotografiche/,Elettronica,Fotocamera
Il Miglior Ripetitore di Segnale Wi-Fi (Range Extender) del 2022,https://latop10.it/migliori-ripetitori-wi-fi/,Elettronica,Internet
Il Miglior Router WiFi (anche Potente) – Classifica 2022,https://latop10.it/migliori-router-wi-fi/,Elettronica,Internet
"Il Migliore Powerline WiFi – Guida all’Acquisto, Classifica 2022",https://latop10.it/migliori-powerline-wi-fi/,Elettronica,Internet
"La Migliore Chiavetta Internet (anche 4G, Illimitata) – Classifica 2022",https://latop10.it/migliori-chiavette-internet/,Elettronica,Internet
"La Migliore Antenna Wifi a Lunga Distanza (USB, per PC) del 2022",https://latop10.it/migliori-antenne-wifi-a-lunga-distanza/,Elettronica,Internet
"Il Miglior Extender Wifi (Ripetitore, Amplificatore) del 2022",https://latop10.it/migliori-extender-wifi/,Elettronica,Internet
"Il Miglior Amplificatore di Segnale Wifi (anche Potente,da Esterno)",https://latop10.it/migliori-amplificatori-di-segnale-wifi/,Elettronica,Internet
La Migliore Scheda di Rete WiFi (per PC Fisso o Notebook) del 2022,https://latop10.it/migliori-schede-di-rete-wifi/,Elettronica,Internet
"I Migliori Router 4G (anche Wifi, con SIM) – Classifica 2022",https://latop10.it/migliori-router-4g/,Elettronica,Internet
"Il Miglior Switch HDMI – Guida all’Acquisto, Classifica 2022",https://latop10.it/migliori-switch-hdmi/,Elettronica,Internet
La Miglior Antenna Wi-Fi Lunga Distanza da Esterno – Classifica 2022,https://latop10.it/migliori-antenne-wi-fi-lunga-distanza-da-esterno/,Elettronica,Internet
Il Miglior Ripetitore Wi-Fi da Esterno – Classifica 2022,https://latop10.it/migliori-ripetitori-wi-fi-da-esterno/,Elettronica,Internet
"La Miglior Scheda di Rete Ethernet – Recensioni, Classifica 2022",https://latop10.it/migliori-schede-di-rete-ethernet/,Elettronica,Internet
Il Miglior Switch di Rete (anche con 4 o 8 Porte) – Classifica 2022,https://latop10.it/migliori-switch-di-rete/,Elettronica,Internet
Il Miglior Modem Router (anche WiFi) – Classifica 2022,https://latop10.it/migliori-modem-router/,Elettronica,Internet
La Migliore Antenna WiFi USB a Lunga Distanza – Classifica 2022,https://latop10.it/migliori-antenne-wifi-usb-a-lunga-distanza/,Elettronica,Internet
"Il Miglior Ripetitore di Rete Netgear – Opinioni, Recensioni 2022",https://latop10.it/migliori-ripetitori-di-rete-netgear/,Elettronica,Internet
"Il Miglior Switch di Rete a 8 Porte – Recensioni, Classifica 2022",https://latop10.it/migliori-switch-di-rete-a-8-porte/,Elettronica,Internet
"Il Miglior Ripetitore di Rete TP Link – Recensioni, Opinioni 2021",https://latop10.it/migliori-ripetitori-di-rete-tp-link/,Elettronica,Internet
"Il Migliore Lettore Blu-ray (anche 4K) – Guida all’Acquisto, Classifica 2022",https://latop10.it/migliori-lettori-blu-ray-4k/,Elettronica,Lettore DVD
"Il Migliori Lettori DVD – Guida all’Acquisto, Classifica 2022",https://latop10.it/migliori-lettori-dvd/,Elettronica,Lettore DVD
Il Miglior Lettore DVD per Auto – Classifica 2022,https://latop10.it/migliori-lettori-dvd-per-auto/,Elettronica,Lettore DVD
Il Miglior Lettore Blu-Ray 3D (anche 4K) – Classifica 2022,https://latop10.it/lettori-blu-ray-3d/,Elettronica,Lettore DVD
"Il Miglior Lettore Blu-Ray 4K Nativo – Recensioni, Classifica 2022",https://latop10.it/migliori-lettori-blu-ray-4k-nativi/,Elettronica,Lettore DVD
