Title,URL,Category 1,Category 2
"Il Miglior Lettore Blu Ray LG – Recensioni, Opinioni 2020",https://latop10.it/migliori-lettori-blu-ray-lg/,Elettronica,Lettore DVD
"Il Miglior Lettore DVD Portatile – Recensioni, Classifica 2022",https://latop10.it/migliori-lettori-dvd-portatili/,Elettronica,Lettore DVD
"La Migliore Tastiera da Gaming – Guida all’Acquisto, Classifica 2022",https://latop10.it/migliori-tastiere-da-gaming/,Elettronica,Mouse & Tastiera
"Il Miglior Mouse Gaming (anche Economico, Cablato o Wireless)",https://latop10.it/migliori-mouse-da-gaming/,Elettronica,Mouse & Tastiera
"Il Miglior Mouse Verticale (anche Ergonomici) – Opinioni, Classifica 2022",https://latop10.it/migliori-mouse-verticali/,Elettronica,Mouse & Tastiera
"La Migliore Tastiera Wireless (senza Fili, con Bluetooth, Retroilluminate)",https://latop10.it/migliori-tastiere-wireless/,Elettronica,Mouse & Tastiera
"Il Migliore Mouse Wireless (senza Fili, Bluetooth) – Classifica 2022",https://latop10.it/migliori-mouse-wireless/,Elettronica,Mouse & Tastiera
La Migliore Tastiera Compatibile con Mac – Classifica 2022,https://latop10.it/migliori-tastiere-per-mac/,Elettronica,Mouse & Tastiera
La Migliore Tastiera Bluetooth (anche per Tablet) del 2022,https://latop10.it/migliori-tastiere-bluetooth/,Elettronica,Mouse & Tastiera
"La Miglior Tastiera per iPad – Recensioni, Classifica 2022",https://latop10.it/migliori-tastiere-per-ipad/,Elettronica,Mouse & Tastiera
"La Miglior Tastiera per PC – Guida all’Acquisto, Classifica 2022",https://latop10.it/migliori-tastiere-per-pc/,Elettronica,Mouse & Tastiera
"Il Miglior Mouse con Trackball – Guida all’Acquisto, Classifica 2022",https://latop10.it/migliori-mouse-con-trackball/,Elettronica,Mouse & Tastiera
"La Miglior Mini Tastiera Wireless – Recensioni, Classifica 2022",https://latop10.it/migliori-mini-tastiere-wireless/,Elettronica,Mouse & Tastiera
"Il Miglior Mouse – Recensioni, Classifica 2022",https://latop10.it/migliori-mouse/,Elettronica,Mouse & Tastiera
"Il Miglior Obiettivo Nikon – Guida all’Acquisto, Classifica 2022",https://latop10.it/migliori-obiettivi-nikon/,Elettronica,Obbietivo
"Il Miglior Obiettivo Nikon DX – Guida all’Acquisto, Classifica 2022",https://latop10.it/migliori-obiettivi-nikon-dx/,Elettronica,Obbietivo
Il Miglior Obiettivo Nikon FX (Full Frame) – Classifica 2022,https://latop10.it/migliori-obiettivi-nikon-fx/,Elettronica,Obbietivo
"Il Migliore Obiettivo Nikon 70-300 mm – Recensioni, Classifica 2022",https://latop10.it/migliori-obiettivi-nikon-70-300-mm/,Elettronica,Obbietivo
Il Miglior Obiettivo Canon (anche Tuttofare) – Classifica 2022,https://latop10.it/migliori-obiettivi-canon/,Elettronica,Obbietivo
"Il Miglior Obiettivo Canon 18-55 – Recensioni, Classifica 2022",https://latop10.it/migliori-obiettivi-canon-18-55/,Elettronica,Obbietivo
"Il Miglior Teleobiettivo – Recensioni, Classifica 2022",https://latop10.it/migliori-teleobiettivi/,Elettronica,Obbietivo
Qual è il Miglior Computer / PC Portatile (Notebook)? Confronto 2021,https://latop10.it/miglior-computer-pc-portatile/,Elettronica,PC
"Il Miglior PC All in One – Guida all’Acquisto, Classifica 2022",https://latop10.it/migliori-pc-all-in-one/,Elettronica,PC
I 7 Migliori Notebook Convertibili 2 in 1 (anche Economici) del 2022,https://latop10.it/migliori-notebook-convertibile/,Elettronica,PC
"Il Miglior Monitor PC (per Casa, Ufficio o Gaming) del 2022",https://latop10.it/migliori-monitor-pc/,Elettronica,PC
"Il Miglior Antivirus (a Pagamento o Gratis, per Windows o Macbook)",https://latop10.it/migliori-antivirus/,Elettronica,PC
La Migliore Base di Raffreddamento per Notebook – Classifica 2022,https://latop10.it/migliori-basi-di-raffreddamento-per-notebook/,Elettronica,PC
Il Miglior Computer Fisso (PC Desktop) – Classifica 2022,https://latop10.it/migliori-computer-fissi/,Elettronica,PC
"Il Miglior Monitor Gaming (anche Economico, 4K, 2K) + Recensioni",https://latop10.it/migliori-monitor-da-gaming/,Elettronica,PC
"Qual è il Miglior PC Fisso da Gaming? – Anche Economici, Recensioni, Prezzi del 2022",https://latop10.it/migliori-pc-fissi-da-gaming/,Elettronica,PC
"Il Miglior Notebook con SSD (anche Processore i5, i7) del 2022",https://latop10.it/migliori-notebook-con-ssd/,Elettronica,PC
"Il Miglior Computer Portatile Asus (Notebook) – Opinioni, Recensioni",https://latop10.it/migliori-computer-portatili-asus/,Elettronica,PC
"Il Miglior Computer Portatile Dell (Notebook) – Opinioni, Recensioni 2022",https://latop10.it/migliori-computer-portatili-dell/,Elettronica,PC
Il Miglior Monitor Touch Screen – Classifica 2022,https://latop10.it/migliori-monitor-touch-screen/,Elettronica,PC
Il Miglior Notebook da 17 Pollici (Computer Portatili) del 2022,https://latop10.it/migliori-notebook-17-pollici/,Elettronica,PC
Il Miglior PC Desktop i7 (Computer Fisso) – Classifica 2022,https://latop10.it/migliori-pc-desktop-i7/,Elettronica,PC
"Il Miglior Computer Portatile HP (Notebook) – Opinioni, Recensioni 2022",https://latop10.it/migliori-computer-portatile-hp/,Elettronica,PC
Il Miglior Computer Fisso Completo (PC Desktop con Monitor) del 2022,https://latop10.it/migliori-computer-fissi-completi/,Elettronica,PC
Il Miglior Mini Computer Portatile (Notebook Piccolo) del 2022,https://latop10.it/migliori-mini-computer-portatili/,Elettronica,PC
"Il Miglior Notebook da 13 Pollici (Computer, PC Portatili) del 2022",https://latop10.it/migliori-notebook-13-pollici/,Elettronica,PC
Il Miglior Notebook SSD i7 (Computer Portatile) del 2022,https://latop10.it/migliori-notebook-ssd-i7/,Elettronica,PC
Il Miglior Notebook i5 (Computer Portatile) – Classifica 2022,https://latop10.it/migliori-notebook-i5/,Elettronica,PC
"Il Miglior Chromebook – Guida all’Acquisto, Classifica 2022",https://latop10.it/migliori-chromebook/,Elettronica,PC
Il Miglior Computer Portatile Toshiba – Classifica 2022,https://latop10.it/migliori-computer-portatili-toshiba/,Elettronica,PC
Il Miglior Computer Portatile Samsung – Classifica 2022,https://latop10.it/miglior-computer-portatile-samsung/,Elettronica,PC
Il Miglior Portatile da Gaming (anche Economici) – Classifica 2022,https://latop10.it/migliori-portatili-da-gaming/,Elettronica,PC
Il Miglior Computer Portatile Acer – Classifica 2022,https://latop10.it/migliori-computer-portatili-acer/,Elettronica,PC
"Il Miglior Server Nas (anche Domestico, Casalingo) – Classifica 2022",https://latop10.it/migliori-server-nas/,Elettronica,PC
Il Miglior PC All in One Lenovo – Classifica 2022,https://latop10.it/migliori-pc-all-in-one-lenovo/,Elettronica,PC
"Il Miglior Barebone – Guida all’Acquisto, Classifica 2022",https://latop10.it/migliori-barebone/,Elettronica,PC
Il Miglior Notebook da 13 Pollici i7 – Classifica 2022,https://latop10.it/migliori-notebook-13-pollici-i7/,Elettronica,PC
"Il Miglior PC All in One i7 – Recensioni, Classifica 2022",https://latop10.it/migliori-pc-all-in-one-i7/,Elettronica,PC
"Il Miglior PC da Gaming i7 – Recensioni, Classifica 2022",https://latop10.it/migliori-pc-da-gaming-i7/,Elettronica,PC
"Il Miglior Notebook Asus i3 – Recensioni, Classifica 2022",https://latop10.it/migliori-notebook-asus-i3/,Elettronica,PC
Il Miglior Computer Desktop HP (PC Fisso) – Classifica 2022,https://latop10.it/migliori-computer-desktop-hp/,Elettronica,PC
"Il Miglior Supporto per PC Portatile – Recensioni, Classifica 2022",https://latop10.it/migliori-supporti-per-pc-portatile/,Elettronica,PC
"Il Miglior Notebook da Gaming – Recensioni, Classifica 2022",https://latop10.it/migliori-notebook-da-gaming/,Elettronica,PC
"Il Miglior Localizzatore Satellitare (GPS Tracker) senza Sim (per Auto, Cane o Gatto)",https://latop10.it/migliori-localizzatori-satellitari/,Elettronica,Piccoli dispositivi
Il Miglior Levapelucchi Elettrici (anche Professionali) del 2022,https://latop10.it/migliori-levapelucchi-elettrici/,Elettronica,Piccoli dispositivi
"La Migliore Microcamera Spia (anche senza Fili, Lunga Durata)",https://latop10.it/migliori-microcamere-spia/,Elettronica,Piccoli dispositivi
Il Miglior Collare GPS per Cani e Gatti – Classifica 2022,https://latop10.it/migliori-collari-gps/,Elettronica,Piccoli dispositivi
Il Migliore GPS Portatile (anche per Trekking) – Classifica 2022,https://latop10.it/migliori-gps-portatili/,Elettronica,Piccoli dispositivi
Il Miglior Localizzatore GPS Spia – Classifica 2022,https://latop10.it/migliori-localizzatori-gps-spia/,Elettronica,Piccoli dispositivi
La Miglior Mini Telecamera Spia Wi-Fi (Microcamere) – Classifica 2022,https://latop10.it/migliori-mini-telecamere-spia-wifi/,Elettronica,Piccoli dispositivi
La Migliore Presa Intelligente WiFi – Classifica 2022,https://latop10.it/migliori-prese-intelligenti-wi-fi/,Elettronica,Presa
Il Miglior Adattatore per Presa Inglese – Classifica 2022,https://latop10.it/migliori-adattatori-per-presa-inglese/,Elettronica,Presa
Il Miglior Adattatore Powerline (Wi-Fi) – Classifica 2022,https://latop10.it/migliori-adattatori-powerline/,Elettronica,Presa
Il Miglior Adattatore Americano – Classifica 2022,https://latop10.it/migliori-adattatori-americani/,Elettronica,Presa
"La Miglior Presa con Telecomando – Recensioni, Classifica 2022",https://latop10.it/migliori-prese-con-telecomando/,Elettronica,Presa
La Miglior Multipresa (Ciabatta Elettrica) – Classifica 2022,https://latop10.it/migliori-multiprese/,Elettronica,Presa
Il Miglior Proiettore (anche Economico) – Classifica 2022,https://latop10.it/migliori-proiettori/,Elettronica,Proiettore
"Il Miglior Proiettore Portatile (Mini, anche Full HD) del 2022",https://latop10.it/migliori-proiettori-portatili/,Elettronica,Proiettore
"Il Miglior Videoproiettore LED – Guida all’Acquisto, Classifica 2022",https://latop10.it/migliori-videoproiettori-led/,Elettronica,Proiettore
"Il Miglior Mini Proiettore (anche Portatile, Full HD, 4K) del 2022",https://latop10.it/migliori-mini-proiettori/,Elettronica,Proiettore
Il Miglior Proiettore Portatile 4k (anche Economico) del 2022,https://latop10.it/migliori-proiettori-portatili-4k/,Elettronica,Proiettore
Il Miglior Proiettore di Luci Natalizie (per Esterno) del 2022,https://latop10.it/migliori-proiettori-di-luci-di-natale/,Elettronica,Proiettore
"Il Miglior Proiettore Full HD – Recensioni, Classifica 2022",https://latop10.it/migliori-proiettori-full-hd/,Elettronica,Proiettore
Il Miglior Proiettore 4K (anche Economici) – Classifica 2022,https://latop10.it/migliori-proiettori-4k/,Elettronica,Proiettore
Il Miglior Mini Proiettore per Smartphone (Portatile) del 2022,https://latop10.it/migliori-mini-proiettori-per-smartphone/,Elettronica,Proiettore
"La Miglior Radiosveglia con Proiettore – Recensioni, Classifica 2022",https://latop10.it/migliori-radiosveglie-con-proiettore/,Elettronica,Proiettore
"Il Miglior Proiettore Epson – Recensioni, Opinioni, Classifica 2022",https://latop10.it/migliori-proiettori-epson/,Elettronica,Proiettore
"Il Miglior Mini Proiettore WiFi – Recensioni, Classifica 2022",https://latop10.it/migliori-mini-proiettori-wifi/,Elettronica,Proiettore
"Il Miglior Proiettore Verticale – Recensioni, Classifica 2022",https://latop10.it/migliori-proiettori-verticali/,Elettronica,Proiettore
"Il Miglior Registratore Vocale (per Università, Spia …) del 2022",https://latop10.it/migliori-registratori-vocali/,Elettronica,Registratore
"Il Miglior Videoregistratore (anche VHS Nuovo e DVD, Digitali) del 2022",https://latop10.it/migliori-videoregistratori/,Elettronica,Registratore
Il Miglior Videoregistratore Digitale per TV – Classifica 2022,https://latop10.it/migliori-registratori-per-tv/,Elettronica,Registratore
"Il Miglior Registratore Vocale Spia (anche Mini, Economici)",https://latop10.it/migliori-registratori-vocali-spia/,Elettronica,Registratore
Il Miglior Videoregistratore VHS (anche Nuovi) – Classifica 2022,https://latop10.it/migliori-videoregistratori-vhs/,Elettronica,Registratore
Il Miglior Registratore Cassette – Classifica 2022,https://latop10.it/migliori-registratori-cassette/,Elettronica,Registratore
"Il Miglior Masterizzatore DVD-RW – Recensioni, Classifica 2022",https://latop10.it/migliori-masterizzatori-dvd-rw/,Elettronica,Registratore
"Il Miglior Videoregistratore Digitale – Recensioni, Classifica 2022",https://latop10.it/migliori-videoregistratori-digitali/,Elettronica,Registratore
"Il Miglior Registratore Vocale Sony – Recensioni, Opinioni 2021",https://latop10.it/migliori-registratori-vocali-sony/,Elettronica,Registratore
Il Miglior Registratore Vocale Professionale – Classifica 2022,https://latop10.it/migliori-registratori-vocali-professionali/,Elettronica,Registratore
"Il Miglior Smartwatch del 2022 – Ottimo Rapporto Qualità-Prezzo, Recensioni",https://latop10.it/migliori-smartwatch/,Elettronica,Smartwatch
"Samsung Gear S3 Frontier – Recensione, Opinioni, Prezzi del 2022",https://latop10.it/samsung-gear-s3-frontier-recensione/,Elettronica,Smartwatch
"Huawei Watch 2 – Recensione, Opinioni, Prezzi del 2022",https://latop10.it/huawei-watch-2-recensione/,Elettronica,Smartwatch
"Il Miglior Orologio Smartwatch (anche per Android, iOS) del 2022",https://latop10.it/migliori-orologi-smartwatch/,Elettronica,Smartwatch
"Il Miglior Orologio Smartwatch U8 – Recensioni, Classifica 2022",https://latop10.it/migliori-orologi-smartwatch-u8/,Elettronica,Smartwatch
Il Miglior Orologio Intelligente – Classifica 2022,https://latop10.it/migliori-orologi-intelligenti/,Elettronica,Smartwatch
"Il Miglior Smartwatch per Bambini – Recensioni, Classifica 2022",https://latop10.it/migliori-smartwatch-per-bambini/,Elettronica,Smartwatch
Il Miglior Orologio Smartwatch Bluetooth – Classifica 2022,https://latop10.it/migliori-orologi-smartwatch-bluetooth/,Elettronica,Smartwatch
"Il Miglior Smartwatch Samsung – Recensioni, Opinioni 2021",https://latop10.it/migliori-smartwatch-samsung/,Elettronica,Smartwatch
La Migliore Stampante 3D Economica – Classifica 2022,https://latop10.it/migliori-stampanti-3d-economiche/,Elettronica,Stampante & Scanner
La Migliore Stampante Multifunzione – Classifica 2022,https://latop10.it/migliori-stampanti-multifunzione/,Elettronica,Stampante & Scanner
"La Migliore Stampante Laser – Guida all’Acquisto, Classifica 2022",https://latop10.it/migliori-stampanti-laser/,Elettronica,Stampante & Scanner
La Migliore Stampante Fotografica – Classifica 2022,https://latop10.it/migliori-stampanti-fotografiche/,Elettronica,Stampante & Scanner
Il Miglior Scanner per Diapositive – Classifica 2022,https://latop10.it/migliori-scanner-per-diapositive/,Elettronica,Stampante & Scanner
"Il Miglior Scanner Portatile – Guida all’Acquisto, Classifica 2022",https://latop10.it/migliori-scanner-portatili/,Elettronica,Stampante & Scanner
"La Migliore Stampante Portatile (Mini, Piccole e per Smartphone)",https://latop10.it/migliori-stampanti-portatili/,Elettronica,Stampante & Scanner
La Migliore Fotocopiatrice (anche Professionale) del 2022,https://latop10.it/migliori-fotocopiatrici/,Elettronica,Stampante & Scanner
"Il Migliore Scanner 3D (anche Economico, Portatile) del 2022",https://latop10.it/migliori-scanner-3d/,Elettronica,Stampante & Scanner
La Migliore Stampante Multifunzione WiFi – Classifica 2022,https://latop10.it/migliori-stampanti-multifunzioni-wifi/,Elettronica,Stampante & Scanner
"Il Miglior Scanner (anche per Negativi, Documenti, Libri)",https://latop10.it/migliori-scanner/,Elettronica,Stampante & Scanner
"La Migliore Stampante (anche Multifunzione, Laser, Inkjet, con Wi-Fi)",https://latop10.it/migliori-stampanti/,Elettronica,Stampante & Scanner
"La Migliore Stampante Samsung Multifunzione – Opinioni, Recensioni 2022",https://latop10.it/migliori-stampanti-samsung-multifunzioni/,Elettronica,Stampante & Scanner
"La Migliore Stampante Epson – Opinioni, Recensioni 2022",https://latop10.it/migliori-stampanti-epson/,Elettronica,Stampante & Scanner
La Miglior Stampante Fotografica Portatile – Classifica 2022,https://latop10.it/migliori-stampanti-fotografiche-portatili/,Elettronica,Stampante & Scanner
"La Miglior Stampante per Etichette – Recensioni, Classifica 2022",https://latop10.it/migliori-stampanti-per-etichette/,Elettronica,Stampante & Scanner
La Miglior Stampante Laser Wireless (WiFi) – Classifica 2022,https://latop10.it/migliori-stampanti-laser-wireless/,Elettronica,Stampante & Scanner
"La Miglior Stampante a LED – Recensioni, Classifica 2022",https://latop10.it/migliori-stampanti-a-led/,Elettronica,Stampante & Scanner
Il Miglior Inchiostro per Stampante (Cartucce) – Classifica 2022,https://latop10.it/migliori-inchiostri-per-stampanti/,Elettronica,Stampante & Scanner
La Migliore Stampante Fotografica Canon – Recensioni 2022,https://latop10.it/migliori-stampanti-fotografiche-canon/,Elettronica,Stampante & Scanner
"Il Miglior Kit per Stampante 3D – Recensioni, Classifica 2022",https://latop10.it/migliori-kit-per-stampanti-3d/,Elettronica,Stampante & Scanner
"Il Miglior Filamento per Stampante 3D – Recensioni, Classifica 2022",https://latop10.it/migliori-filamenti-per-stampanti-3d/,Elettronica,Stampante & Scanner
"Il Miglior Toner per Stampante – Recensioni, Classifica 2022",https://latop10.it/migliori-toner-per-stampante/,Elettronica,Stampante & Scanner
"La Migliore Stampante Inkjet – Recensioni, Classifica 2022",https://latop10.it/migliori-stampanti-inkjet/,Elettronica,Stampante & Scanner
"La Miglior Radiosveglia (anche Digitali, da Comodino) del 2022",https://latop10.it/migliori-radiosveglie/,Elettronica,Sveglia
La Migliore Sveglia da Comodino (anche Digitale) – Classifica 2022,https://latop10.it/migliori-sveglie-da-comodino/,Elettronica,Sveglia
"La Migliore Radiosveglia Oregon – Opinioni, Recensioni 2022",https://latop10.it/migliori-radiosveglie-oregon/,Elettronica,Sveglia
"La Miglior Sveglia Oregon – Recensioni, Opinioni 2021",https://latop10.it/migliori-sveglie-oregon/,Elettronica,Sveglia
"La Migliore Sveglia Parlante – Recensioni, Classifica 2022",https://latop10.it/migliori-sveglie-parlanti/,Elettronica,Sveglia
"Il Miglior Tablet Windows – Guida all’Acquisto, Classifica 2022",https://latop10.it/migliori-tablet-windows/,Elettronica,Tablet & eReader
"Il Miglior eReader – Recensioni, Opinioni, Classifica 2022",https://latop10.it/migliori-ereader/,Elettronica,Tablet & eReader
"Il Miglior Tablet Samsung del 2022 + Opinioni, Recensioni",https://latop10.it/migliori-tablet-samsung/,Elettronica,Tablet & eReader
"Il Miglior Tablet (anche Android, Top Rapporto Qualità Prezzo)",https://latop10.it/migliori-tablet/,Elettronica,Tablet & eReader
"Il Miglior Ebook Reader Sony – Opinioni, Recensioni, Prezzi 2020",https://latop10.it/migliori-ebook-reader-sony/,Elettronica,Tablet & eReader
"Il Miglior Tablet Asus – Guida all’Acquisto, Classifica 2022",https://latop10.it/migliori-tablet-asus/,Elettronica,Tablet & eReader
"La Miglior Tablet PC (2 in 1, Convertibile) – Classifica 2022",https://latop10.it/migliori-tablet-pc/,Elettronica,Tablet & eReader
"Il Miglior Supporto Tablet – Guida all’Acquisto, Classifica 2022",https://latop10.it/migliori-supporti-tablet/,Elettronica,Tablet & eReader
Il Miglior Supporto per Tablet da Letto – Classifica 2022,https://latop10.it/migliori-supporti-per-tablet-da-letto/,Elettronica,Tablet & eReader
"La Miglior Custodia per Kindle (Cover) – Recensioni, Classifica 2022",https://latop10.it/migliori-custodie-per-kindle/,Elettronica,Tablet & eReader
"Il Miglior Kindle Ebook Reader – Classifica, Recensioni 2022",https://latop10.it/migliori-kindle-ebook-reader/,Elettronica,Tablet & eReader
"Il Miglior Supporto Tablet per Auto – Recensioni, Classifica 2022",https://latop10.it/migliori-supporti-tablet-per-auto/,Elettronica,Tablet & eReader
"Il Miglior Tablet Economico – Recensioni, Classifica 2022",https://latop10.it/migliori-tablet-economici/,Elettronica,Tablet & eReader
"Il Miglior iPad – Recensioni, Opinioni, Classifica 2022",https://latop10.it/migliori-ipad/,Elettronica,Tablet & eReader
"La Migliore Custodia per Tablet – Recensioni, Classifica 2022",https://latop10.it/migliori-custodie-per-tablet/,Elettronica,Tablet & eReader
Il Miglior Telefono Cordless (anche Duo) – Classifica 2022,https://latop10.it/migliori-telefoni-cordless/,Elettronica,Telefono
Il Miglior Salvavita per Anziani – Classifica 2022,https://latop10.it/migliori-salvavita-per-anziani/,Elettronica,Telefono
Il Miglior Telefono Fisso (anche per Anziani) – Classifica 2022,https://latop10.it/migliori-telefoni-fissi/,Elettronica,Telefono
Il Miglior Smartphone in Commercio del 2022 (Top Qualità Prezzo),https://latop10.it/migliori-smartphone/,Elettronica,Telefono
Il Miglior Cellulare per Anziani (Telefoni anche con Tasti Grandi),https://latop10.it/migliori-cellulari-per-anziani/,Elettronica,Telefono
Il Miglior Phablet / Smartphone di 7 Pollici – Classifica 2022,https://latop10.it/migliori-phablet-di-7-pollici/,Elettronica,Telefono
"Il Miglior Combinatore Telefonico GSM (anche Universale, Economico)",https://latop10.it/migliori-combinatori-telefonici-gsm/,Elettronica,Telefono
"Il Miglior Cordless Duo – Guida all’Acquisto, Classifica 2022",https://latop10.it/migliori-cordless-duo/,Elettronica,Telefono
"Huawei Nova Young – Recensione, Opinioni, Prezzi del 2022",https://latop10.it/huawei-nova-young-recensione/,Elettronica,Telefono
"Huawei P9 Lite – Recensione, Opinioni, Prezzi del 2022",https://latop10.it/huawei-p9-lite-recensione/,Elettronica,Telefono
"Honor 9 Lite – Recensione, Opinioni, Prezzi del 2022",https://latop10.it/honor-9-lite-recensione/,Elettronica,Telefono
"La Migliore Batteria Esterna (per Smartphone, Cellulare) del 2022",https://latop10.it/migliori-batterie-esterne/,Elettronica,Telefono
La Miglior Pellicola Protettiva per iPhone – Classifica 2022,https://latop10.it/migliori-pellicole-protettive-per-iphone/,Elettronica,Telefono
"Il Miglior Telefono VoIP (WiFi) – Recensioni, Classifica 2022",https://latop10.it/migliori-telefoni-voip/,Elettronica,Telefono
"La Migliore Cover per Smartphone – Recensioni, Classifica 2022",https://latop10.it/migliori-cover-per-smartphone/,Elettronica,Telefono
"La Miglior Custodia per Cellulare – Recensioni, Classifica 2022",https://latop10.it/migliori-custodie-per-cellulare/,Elettronica,Telefono
"Il Miglior Huawei – Recensioni, Opinioni, Classifica 2022",https://latop10.it/migliori-huawei/,Elettronica,Telefono
"Il Miglior iPhone – Recensioni, Opinioni, Classifica 2022",https://latop10.it/migliori-iphone/,Elettronica,Telefono
"Il Miglior Smartphone Samsung – Recensioni, Opinioni Classifica 2022",https://latop10.it/migliori-smartphone-samsung/,Elettronica,Telefono
Il Miglior Supporto Smartphone per Auto – Classifica 2022,https://latop10.it/migliori-supporti-smartphone-per-auto/,Elettronica,Telefono
"La Migliore Marca TV 4K – Guida all’Acquisto, Classifica 2022",https://latop10.it/migliore-marca-tv-4k/,Elettronica,TV
La Miglior Smart TV da 32 Pollici (anche 4K) – Classifica 2022,https://latop10.it/migliori-tv-32-pollici/,Elettronica,TV
"La Migliore TV 4K a Confronto – Guida all’Acquisto, Classifica 2022",https://latop10.it/migliori-tv-4k/,Elettronica,TV
"La Migliore Smart TV – Opinioni, Recensioni, Classifica 2022",https://latop10.it/migliori-smart-tv/,Elettronica,TV
"Il Miglior Smart TV Box (Android, IPTV, Google, … ) del 2022",https://latop10.it/migliori-tv-box/,Elettronica,TV
"La Migliore TV OLED (anche 4K) – Guida all’Acquisto, Classifica 2022",https://latop10.it/migliori-tv-oled/,Elettronica,TV
La Migliore Smart TV da 40 Pollici (anche 4K) – Recensioni 2022,https://latop10.it/migliori-smart-tv-da-40-pollici/,Elettronica,TV
Il Miglior Telecomando Universale per TV – Classifica 2022,https://latop10.it/migliori-telecomandi-universali-per-tv/,Elettronica,TV
La Migliore TV Samsung da 55 Pollici 4K – Recensioni 2022,https://latop10.it/migliori-tv-samsung-4k-da-55-pollici/,Elettronica,TV
"Il Migliore TV LED (anche Full HD, 4K) – Classifica 2022",https://latop10.it/migliori-tv-led/,Elettronica,TV
"La Migliore TV 4K con 3D – Opinioni, Recensioni, Prezzi",https://latop10.it/migliori-tv-4k-con-3d/,Elettronica,TV
La Migliore TV 55 Pollici (anche Smart) – Classifica 2022,https://latop10.it/migliori-tv-55-pollici/,Elettronica,TV
La Migliore TV Portatile (Mini Televisore) – Classifica 2022,https://latop10.it/migliori-tv-portatili/,Elettronica,TV
"La Miglior TV 4K da 49 Pollici – Recensioni, Classifica 2022",https://latop10.it/migliori-tv-4k-da-49-pollici/,Elettronica,TV
La Migliore TV da 22 Pollici (anche Smart) – Classifica 2022,https://latop10.it/migliori-tv-da-22-pollici/,Elettronica,TV
"La Migliore TV Box Android + Opinioni, Recensioni 2022",https://latop10.it/migliori-tv-box-android/,Elettronica,TV
"La Miglior TV (anche Smart, 4K, 55 Pollici, 49 Pollici) – Classifica 2022",https://latop10.it/migliori-tv/,Elettronica,TV
La Miglior TV LED da 50 Pollici (anche 4K) – Classifica 2022,https://latop10.it/migliori-tv-led-da-50-pollici/,Elettronica,TV
"La Miglior Smart TV Box x96 – Guida all’Acquisto, Classifica 2022",https://latop10.it/migliori-smart-tv-box-x96/,Elettronica,TV
La Migliore TV da 24 Pollici (anche Smart e Full HD) del 2022,https://latop10.it/migliori-tv-da-24-pollici/,Elettronica,TV
"La Migliore Smart TV Samsung da 40 Pollici – Opinioni, Recensioni 2022",https://latop10.it/migliori-smart-tv-samsung-da-40-pollici/,Elettronica,TV
"La Migliore TV 4K LG – Opinioni, Recensioni 2022",https://latop10.it/migliori-tv-4k-lg/,Elettronica,TV
La Migliore Smart TV da 28 Pollici (anche Full HD) – Classifica 2022,https://latop10.it/migliori-smart-tv-da-28-pollici/,Elettronica,TV
"La Migliore TV 3D (anche Smart, 4K, Passivo) del 2022",https://latop10.it/migliori-tv-3d/,Elettronica,TV
"La Miglior Smart TV 4K – Guida all’Acquisto, Classifica 2022",https://latop10.it/migliori-smart-tv-4k/,Elettronica,TV
